{
  "$schema": "https://json-schema.org/draft/2020-12/schema",
  "title": "Type Moon World servant skill",
  "type": "object",
  "additionalProperties": false,
  "properties": {
    "id": {
      "type": "string",
      "maxLength": 128
    },
    "display_name": {
      "type": "string",
      "maxLength": 128
    },
    "display_name_zh": {
      "type": "string",
      "maxLength": 128
    },
    "type": {
      "enum": [
        "active",
        "passive",
        "triggered"
      ]
    },
    "mp_cost": {
      "type": "integer",
      "minimum": 0
    },
    "cooldown_ticks": {
      "type": "integer",
      "minimum": 0
    },
    "duration_ticks": {
      "type": "integer",
      "minimum": 0
    },
    "effects": {
      "type": "array",
      "maxItems": 64,
      "items": {
        "type": "object"
      }
    },
    "ai": {
      "type": "object",
      "additionalProperties": false,
      "properties": {
        "facts": {
          "type": "array",
          "maxItems": 24,
          "items": {
            "type": "object",
            "additionalProperties": false,
            "required": [
              "type"
            ],
            "properties": {
              "type": {
                "enum": [
                  "melee_pressure",
                  "projectile_pressure",
                  "magic_pressure",
                  "area_control",
                  "control",
                  "gap_close",
                  "pursuit",
                  "heal",
                  "prediction",
                  "projectile_negation",
                  "magic_resistance",
                  "shield",
                  "revive",
                  "regeneration",
                  "damage_threshold",
                  "adaptive_defense",
                  "concealment",
                  "anti_divine",
                  "anti_mystery"
                ]
              },
              "strength": {
                "type": "number",
                "minimum": 0,
                "maximum": 1
              },
              "requires": {
                "type": "array",
                "uniqueItems": true,
                "items": {
                  "enum": [
                    "mobile",
                    "not_silenced",
                    "low_health",
                    "daylight",
                    "on_ground",
                    "has_mana"
                  ]
                }
              },
              "bypassed_by": {
                "type": "array",
                "uniqueItems": true,
                "items": {
                  "enum": [
                    "immobilize",
                    "stun",
                    "freeze",
                    "explosion",
                    "piercing",
                    "sure_hit",
                    "rule_breaker",
                    "anti_divine",
                    "anti_mystery"
                  ]
                }
              }
            }
          }
        }
      }
    },
    "rank": {
      "type": "string",
      "pattern": "^(EX|[EDCBA][+\\-]{0,3})$"
    },
    "defense": {
      "type": "object",
      "properties": {
        "evasion": {
          "type": "boolean"
        },
        "guard": {
          "type": "boolean"
        },
        "durability": {
          "type": "boolean"
        },
        "activation_actions": {
          "type": "array",
          "items": {
            "type": "string"
          }
        }
      }
    }
  }
}
